{
  "formatVersion": 2,
  "kind": "irogen-test-plan",
  "name": "Unschärfeschutz: saubere Gegenbilder und vollständige Ablehnung",
  "defaults": {
    "seed": 12345,
    "width": 1600,
    "height": 1200,
    "fieldCount": 3,
    "matchingField": 1,
    "position": "Right",
    "stripWidthPercent": 28,
    "stripLengthPercent": 70,
    "gapPercent": 6,
    "labels": false,
    "roundedTop": false,
    "colors": {
      "coverageBand": "Feste Geometriepruefung",
      "anchorField": 1,
      "targetDeltaE": 0,
      "palette": [
        {
          "g": 80,
          "b": 110,
          "r": 60
        },
        {
          "g": 110,
          "b": 140,
          "r": 90
        },
        {
          "g": 140,
          "b": 170,
          "r": 120
        }
      ],
      "wall": {
        "g": 140,
        "b": 140,
        "r": 140
      }
    }
  },
  "cases": [
    {
      "options": {
        "position": "Right",
        "noise": "None",
        "orientation": "Vertical"
      },
      "expected": {
        "basis": "Vorab festgelegte Eignungserwartung: homogene scharfe Kontrollen messbar; starke modellierte Fokus-/Bewegungsunschärfe vollständig sperren. Keine Rekonstruktion. Unabhängige Pixelgegenproben in BlurSafetyTests und Nachweis docs/unschaerfe-schutzpruefung.md.",
        "formatVersion": 1,
        "measurementAllowed": true,
        "requiredHint": "None",
        "releasedFieldCount": 3,
        "verification": "verified"
      },
      "coverRange": false,
      "name": "Vertical - None - Rauschen None",
      "count": 1
    },
    {
      "options": {
        "blur": "Strong",
        "position": "Right",
        "noise": "None",
        "orientation": "Vertical"
      },
      "expected": {
        "basis": "Vorab festgelegte Eignungserwartung: homogene scharfe Kontrollen messbar; starke modellierte Fokus-/Bewegungsunschärfe vollständig sperren. Keine Rekonstruktion. Unabhängige Pixelgegenproben in BlurSafetyTests und Nachweis docs/unschaerfe-schutzpruefung.md.",
        "formatVersion": 1,
        "measurementAllowed": false,
        "requiredHint": "UnusableBlur",
        "releasedFieldCount": 0,
        "verification": "verified"
      },
      "coverRange": false,
      "name": "Vertical - Focus - Rauschen None",
      "count": 1
    },
    {
      "options": {
        "motionBlur": "Strong",
        "position": "Right",
        "noise": "None",
        "orientation": "Vertical"
      },
      "expected": {
        "basis": "Vorab festgelegte Eignungserwartung: homogene scharfe Kontrollen messbar; starke modellierte Fokus-/Bewegungsunschärfe vollständig sperren. Keine Rekonstruktion. Unabhängige Pixelgegenproben in BlurSafetyTests und Nachweis docs/unschaerfe-schutzpruefung.md. Präzisierung 27. September 2026: Dieser Fall wird bereits wegen mehrdeutiger Geometrie abgelehnt; kein belegter Unschärfecode.",
        "formatVersion": 1,
        "measurementAllowed": false,
        "requiredHint": "Other",
        "releasedFieldCount": 0,
        "verification": "verified"
      },
      "coverRange": false,
      "name": "Vertical - Motion - Rauschen None",
      "count": 1
    },
    {
      "options": {
        "position": "Right",
        "noise": "Light",
        "orientation": "Vertical"
      },
      "expected": {
        "basis": "Vorab festgelegte Eignungserwartung: homogene scharfe Kontrollen messbar; starke modellierte Fokus-/Bewegungsunschärfe vollständig sperren. Keine Rekonstruktion. Unabhängige Pixelgegenproben in BlurSafetyTests und Nachweis docs/unschaerfe-schutzpruefung.md.",
        "formatVersion": 1,
        "measurementAllowed": true,
        "requiredHint": "None",
        "releasedFieldCount": 3,
        "verification": "verified"
      },
      "coverRange": false,
      "name": "Vertical - None - Rauschen Light",
      "count": 1
    },
    {
      "options": {
        "blur": "Strong",
        "position": "Right",
        "noise": "Light",
        "orientation": "Vertical"
      },
      "expected": {
        "basis": "Vorab festgelegte Eignungserwartung: homogene scharfe Kontrollen messbar; starke modellierte Fokus-/Bewegungsunschärfe vollständig sperren. Keine Rekonstruktion. Unabhängige Pixelgegenproben in BlurSafetyTests und Nachweis docs/unschaerfe-schutzpruefung.md.",
        "formatVersion": 1,
        "measurementAllowed": false,
        "requiredHint": "UnusableBlur",
        "releasedFieldCount": 0,
        "verification": "verified"
      },
      "coverRange": false,
      "name": "Vertical - Focus - Rauschen Light",
      "count": 1
    },
    {
      "options": {
        "motionBlur": "Strong",
        "position": "Right",
        "noise": "Light",
        "orientation": "Vertical"
      },
      "expected": {
        "basis": "Vorab festgelegte Eignungserwartung: homogene scharfe Kontrollen messbar; starke modellierte Fokus-/Bewegungsunschärfe vollständig sperren. Keine Rekonstruktion. Unabhängige Pixelgegenproben in BlurSafetyTests und Nachweis docs/unschaerfe-schutzpruefung.md.",
        "formatVersion": 1,
        "measurementAllowed": false,
        "requiredHint": "UnusableBlur",
        "releasedFieldCount": 0,
        "verification": "verified"
      },
      "coverRange": false,
      "name": "Vertical - Motion - Rauschen Light",
      "count": 1
    },
    {
      "options": {
        "position": "Bottom",
        "noise": "None",
        "orientation": "Horizontal"
      },
      "expected": {
        "basis": "Vorab festgelegte Eignungserwartung: homogene scharfe Kontrollen messbar; starke modellierte Fokus-/Bewegungsunschärfe vollständig sperren. Keine Rekonstruktion. Unabhängige Pixelgegenproben in BlurSafetyTests und Nachweis docs/unschaerfe-schutzpruefung.md.",
        "formatVersion": 1,
        "measurementAllowed": true,
        "requiredHint": "None",
        "releasedFieldCount": 3,
        "verification": "verified"
      },
      "coverRange": false,
      "name": "Horizontal - None - Rauschen None",
      "count": 1
    },
    {
      "options": {
        "blur": "Strong",
        "position": "Bottom",
        "noise": "None",
        "orientation": "Horizontal"
      },
      "expected": {
        "basis": "Vorab festgelegte Eignungserwartung: homogene scharfe Kontrollen messbar; starke modellierte Fokus-/Bewegungsunschärfe vollständig sperren. Keine Rekonstruktion. Unabhängige Pixelgegenproben in BlurSafetyTests und Nachweis docs/unschaerfe-schutzpruefung.md.",
        "formatVersion": 1,
        "measurementAllowed": false,
        "requiredHint": "UnusableBlur",
        "releasedFieldCount": 0,
        "verification": "verified"
      },
      "coverRange": false,
      "name": "Horizontal - Focus - Rauschen None",
      "count": 1
    },
    {
      "options": {
        "motionBlur": "Strong",
        "position": "Bottom",
        "noise": "None",
        "orientation": "Horizontal"
      },
      "expected": {
        "basis": "Vorab festgelegte Eignungserwartung: homogene scharfe Kontrollen messbar; starke modellierte Fokus-/Bewegungsunschärfe vollständig sperren. Keine Rekonstruktion. Unabhängige Pixelgegenproben in BlurSafetyTests und Nachweis docs/unschaerfe-schutzpruefung.md.",
        "formatVersion": 1,
        "measurementAllowed": false,
        "requiredHint": "UnusableBlur",
        "releasedFieldCount": 0,
        "verification": "verified"
      },
      "coverRange": false,
      "name": "Horizontal - Motion - Rauschen None",
      "count": 1
    },
    {
      "options": {
        "position": "Bottom",
        "noise": "Light",
        "orientation": "Horizontal"
      },
      "expected": {
        "basis": "Vorab festgelegte Eignungserwartung: homogene scharfe Kontrollen messbar; starke modellierte Fokus-/Bewegungsunschärfe vollständig sperren. Keine Rekonstruktion. Unabhängige Pixelgegenproben in BlurSafetyTests und Nachweis docs/unschaerfe-schutzpruefung.md.",
        "formatVersion": 1,
        "measurementAllowed": true,
        "requiredHint": "None",
        "releasedFieldCount": 3,
        "verification": "verified"
      },
      "coverRange": false,
      "name": "Horizontal - None - Rauschen Light",
      "count": 1
    },
    {
      "options": {
        "blur": "Strong",
        "position": "Bottom",
        "noise": "Light",
        "orientation": "Horizontal"
      },
      "expected": {
        "basis": "Vorab festgelegte Eignungserwartung: homogene scharfe Kontrollen messbar; starke modellierte Fokus-/Bewegungsunschärfe vollständig sperren. Keine Rekonstruktion. Unabhängige Pixelgegenproben in BlurSafetyTests und Nachweis docs/unschaerfe-schutzpruefung.md.",
        "formatVersion": 1,
        "measurementAllowed": false,
        "requiredHint": "UnusableBlur",
        "releasedFieldCount": 0,
        "verification": "verified"
      },
      "coverRange": false,
      "name": "Horizontal - Focus - Rauschen Light",
      "count": 1
    },
    {
      "options": {
        "motionBlur": "Strong",
        "position": "Bottom",
        "noise": "Light",
        "orientation": "Horizontal"
      },
      "expected": {
        "basis": "Vorab festgelegte Eignungserwartung: homogene scharfe Kontrollen messbar; starke modellierte Fokus-/Bewegungsunschärfe vollständig sperren. Keine Rekonstruktion. Unabhängige Pixelgegenproben in BlurSafetyTests und Nachweis docs/unschaerfe-schutzpruefung.md.",
        "formatVersion": 1,
        "measurementAllowed": false,
        "requiredHint": "UnusableBlur",
        "releasedFieldCount": 0,
        "verification": "verified"
      },
      "coverRange": false,
      "name": "Horizontal - Motion - Rauschen Light",
      "count": 1
    }
  ]
}
