{
  "formatVersion": 2,
  "kind": "irogen-test-plan",
  "name": "Pflichtkontrolle zwischen Arbeitspunkten: sauber und leichtes Rauschen",
  "defaults": {
    "seed": 12345,
    "width": 1600,
    "height": 1200,
    "fieldCount": 3,
    "matchingField": 1,
    "position": "Right",
    "stripWidthPercent": 28,
    "stripLengthPercent": 70,
    "gapPercent": 6,
    "labels": false,
    "roundedTop": false,
    "colors": {
      "coverageBand": "Feste Geometriepruefung",
      "anchorField": 1,
      "targetDeltaE": 0,
      "palette": [
        {
          "g": 80,
          "b": 110,
          "r": 60
        },
        {
          "g": 110,
          "b": 140,
          "r": 90
        },
        {
          "g": 140,
          "b": 170,
          "r": 120
        }
      ],
      "wall": {
        "g": 140,
        "b": 140,
        "r": 140
      }
    }
  },
  "cases": [
    {
      "coverRange": false,
      "options": {
        "orientation": "Vertical",
        "position": "Right"
      },
      "expected": {
        "releasedFieldCount": 3,
        "requiredHint": "None",
        "formatVersion": 1,
        "basis": "Saubere Geometriekontrollen und Pixelrauschen bis ±6 in der Messstabilitätsuntersuchung bestanden. Drei homogene Felder, feste Originalpalette. Ergänzende numerische Gegenprüfung im Zwei-Bilder-Regressionstest.",
        "verification": "verified",
        "measurementAllowed": true
      },
      "count": 1,
      "name": "Sauberes Kontrollbild - drei korrekte Felder"
    },
    {
      "coverRange": false,
      "options": {
        "orientation": "Vertical",
        "position": "Right",
        "noise": "Light"
      },
      "expected": {
        "releasedFieldCount": 3,
        "requiredHint": "None",
        "formatVersion": 1,
        "basis": "Saubere Geometriekontrollen und Pixelrauschen bis ±6 in der Messstabilitätsuntersuchung bestanden. Drei homogene Felder, feste Originalpalette. Ergänzende numerische Gegenprüfung im Zwei-Bilder-Regressionstest.",
        "verification": "verified",
        "measurementAllowed": true
      },
      "count": 1,
      "name": "Leichtes Pixelrauschen - drei korrekte Felder"
    }
  ]
}